{
  "schema_version": "2.0.0",
  "package_spec_version": "1.0.0",
  "release_id": "REL-BZ_03_TEMPERATURE_CORE-1.0.0",
  "package_id": "bz_03_temperature_core",
  "package_version": "1.0.0",
  "knowledge_version": "1.0.0",
  "schema_version_released": "2.0.0",
  "release_date": "2026-08-09",
  "released_at": "2026-08-09T17:30:00Z",
  "release_author": "BTE Knowledge Board",
  "release_notes": "KX-2B Temperature Core. TEC-* climate rules. Strength and Seasonal unchanged.",
  "migration_notes": "Additive V2 package. Dual-read with V1 TMP-* / database/11_temperature.",
  "checksum": {
    "algorithm": "sha256",
    "value": "a2e4826b6beec74c081ceb49fabecdd1fe2e942a000d837dcf1298a12c661427",
    "scope": [
      "CHANGELOG.md",
      "DEPENDENCIES.json",
      "MANIFEST.json",
      "PACKAGE.json",
      "README.md",
      "RELEASE.json",
      "RELEASE_NOTES.md",
      "assets/climate_axes.json",
      "documentation/WAVE2_ROADMAP.md",
      "documentation/assumptions_and_limitations.md",
      "documentation/evidence_model.md",
      "documentation/interaction_seasonal.md",
      "documentation/interaction_strength.md",
      "documentation/overview.md",
      "documentation/philosophy.md",
      "documentation/reasoning_model.md",
      "evidence/bundles/TEC-000001.json",
      "evidence/bundles/TEC-000002.json",
      "evidence/bundles/TEC-000003.json",
      "evidence/bundles/TEC-000004.json",
      "evidence/bundles/TEC-000005.json",
      "evidence/bundles/TEC-000006.json",
      "evidence/bundles/TEC-000007.json",
      "evidence/bundles/TEC-000008.json",
      "evidence/bundles/TEC-000009.json",
      "evidence/bundles/TEC-000010.json",
      "evidence/bundles/TEC-000011.json",
      "evidence/bundles/TEC-000012.json",
      "evidence/bundles/TEC-000013.json",
      "evidence/bundles/TEC-000014.json",
      "evidence/bundles/TEC-000015.json",
      "evidence/bundles/TEC-000016.json",
      "evidence/bundles/TEC-000017.json",
      "evidence/bundles/TEC-000018.json",
      "evidence/bundles/TEC-000019.json",
      "evidence/bundles/TEC-000020.json",
      "evidence/bundles/TEC-000021.json",
      "evidence/bundles/TEC-000022.json",
      "evidence/bundles/TEC-000023.json",
      "evidence/bundles/TEC-000024.json",
      "evidence/bundles/TEC-000025.json",
      "evidence/bundles/TEC-000026.json",
      "evidence/bundles/TEC-000027.json",
      "evidence/bundles/TEC-000028.json",
      "evidence/bundles/TEC-000029.json",
      "evidence/bundles/TEC-000030.json",
      "evidence/bundles/TEC-000031.json",
      "evidence/bundles/TEC-000032.json",
      "evidence/bundles/TEC-000033.json",
      "evidence/bundles/TEC-000034.json",
      "evidence/bundles/TEC-000035.json",
      "evidence/bundles/TEC-000036.json",
      "evidence/bundles/TEC-000037.json",
      "evidence/bundles/TEC-000038.json",
      "evidence/bundles/TEC-000039.json",
      "evidence/bundles/TEC-000040.json",
      "evidence/bundles/TEC-000041.json",
      "evidence/bundles/TEC-000042.json",
      "evidence/bundles/TEC-000043.json",
      "evidence/bundles/TEC-000044.json",
      "evidence/bundles/TEC-000045.json",
      "evidence/bundles/TEC-000046.json",
      "evidence/bundles/TEC-000047.json",
      "evidence/bundles/TEC-000048.json",
      "evidence/bundles/TEC-000049.json",
      "evidence/bundles/TEC-000050.json",
      "evidence/bundles/TEC-000051.json",
      "evidence/bundles/TEC-000052.json",
      "evidence/bundles/TEC-000053.json",
      "evidence/bundles/TEC-000054.json",
      "evidence/bundles/TEC-000055.json",
      "evidence/bundles/TEC-000056.json",
      "evidence/bundles/TEC-000057.json",
      "evidence/bundles/TEC-000058.json",
      "evidence/bundles/TEC-000059.json",
      "evidence/bundles/TEC-000060.json",
      "evidence/bundles/TEC-000061.json",
      "evidence/bundles/TEC-000062.json",
      "evidence/bundles/TEC-000063.json",
      "evidence/bundles/TEC-000064.json",
      "evidence/bundles/TEC-000065.json",
      "evidence/bundles/TEC-000066.json",
      "evidence/bundles/TEC-000067.json",
      "evidence/bundles/TEC-000068.json",
      "evidence/bundles/TEC-000069.json",
      "evidence/bundles/TEC-000070.json",
      "evidence/bundles/TEC-000071.json",
      "evidence/bundles/TEC-000072.json",
      "evidence/bundles/TEC-000073.json",
      "evidence/bundles/TEC-000074.json",
      "evidence/bundles/TEC-000075.json",
      "evidence/bundles/TEC-000076.json",
      "evidence/bundles/TEC-000077.json",
      "evidence/bundles/TEC-000078.json",
      "evidence/bundles/TEC-000079.json",
      "evidence/bundles/TEC-000080.json",
      "evidence/bundles/TEC-000081.json",
      "evidence/bundles/TEC-000082.json",
      "evidence/bundles/TEC-000083.json",
      "evidence/bundles/TEC-000084.json",
      "evidence/bundles/TEC-000085.json",
      "evidence/bundles/TEC-000086.json",
      "evidence/bundles/TEC-000087.json",
      "evidence/bundles/TEC-000088.json",
      "evidence/bundles/TEC-000089.json",
      "evidence/bundles/TEC-000090.json",
      "evidence/bundles/TEC-000091.json",
      "evidence/bundles/TEC-000092.json",
      "evidence/bundles/TEC-000093.json",
      "evidence/bundles/TEC-000094.json",
      "evidence/bundles/TEC-000095.json",
      "evidence/bundles/TEC-000096.json",
      "evidence/bundles/TEC-000097.json",
      "evidence/bundles/TEC-000098.json",
      "evidence/bundles/TEC-000099.json",
      "evidence/bundles/TEC-000100.json",
      "evidence/bundles/TEC-000101.json",
      "evidence/bundles/TEC-000102.json",
      "evidence/bundles/TEC-000103.json",
      "evidence/bundles/TEC-000104.json",
      "evidence/bundles/TEC-000105.json",
      "evidence/bundles/TEC-000106.json",
      "evidence/bundles/TEC-000107.json",
      "evidence/bundles/TEC-000108.json",
      "evidence/bundles/TEC-000109.json",
      "evidence/bundles/TEC-000110.json",
      "evidence/index.json",
      "evidence/references/sources.json",
      "evidence/validation/EVIDENCE_VALIDATION.md",
      "evidence/validation/evidence_validation_rules.json",
      "examples/charts.json",
      "metadata/package_metadata.json",
      "reasoning/chains/balanced.json",
      "reasoning/chains/cold.json",
      "reasoning/chains/hot.json",
      "reasoning/confidence/propagation.json",
      "reasoning/edges/balanced.json",
      "reasoning/edges/cold.json",
      "reasoning/edges/hot.json",
      "reasoning/examples/balanced.json",
      "reasoning/examples/balanced.md",
      "reasoning/examples/cold.json",
      "reasoning/examples/cold.md",
      "reasoning/examples/hot.json",
      "reasoning/examples/hot.md",
      "reasoning/index.json",
      "reasoning/nodes/balanced.json",
      "reasoning/nodes/cold.json",
      "reasoning/nodes/hot.json",
      "reasoning/traces/balanced.json",
      "reasoning/traces/cold.json",
      "reasoning/traces/hot.json",
      "references/references.json",
      "rules/balanced_climate.json",
      "rules/branch_climate.json",
      "rules/climate_correction.json",
      "rules/cold_climate.json",
      "rules/damp_climate.json",
      "rules/dm_temperature_support.json",
      "rules/dry_climate.json",
      "rules/group_priority.json",
      "rules/hot_climate.json",
      "rules/seasonal_temp_adjustment.json",
      "rules/temperature_imbalance.json",
      "rules/temperature_scoring.json",
      "tests/package_assertions.json",
      "tests/test_package.py",
      "validation/VALIDATION.json",
      "validation/profile.json"
    ]
  },
  "supported_platform_versions": {
    "min_platform_version": "1.0.0",
    "min_engine_version": "1.0.0",
    "min_api_version": "1.0.0"
  },
  "immutability": {
    "immutable": true,
    "policy": "released_packages_are_immutable"
  },
  "supersedes": null,
  "breaking_changes": []
}
